{
  "schema_version": "1.0.0",
  "run_id": "nano-todo",
  "first_pass_rate": 1.0,
  "rework_rate": 0.0,
  "escaped_defect_rate": null,
  "cycle_time_p50_minutes": 0.03,
  "cycle_time_p90_minutes": 0.03,
  "cost_per_artifact_usd": null,
  "top_reject_reasons": [],
  "verification_coverage": 1.0,
  "traceability_coverage": 1.0
}
